[
  {
    "id": "drill-js-map-callback",
    "prompt": "Type the JavaScript Array.map callback signature.",
    "expected": "array.map((value, index, array) => result)",
    "normalizers": ["whitespace", "semicolons"],
    "threshold": 3,
    "tags": ["javascript", "arrays"],
    "difficulty": 1
  },
  {
    "id": "drill-js-filter-callback",
    "prompt": "Type the JavaScript Array.filter callback signature.",
    "expected": "array.filter((value, index, array) => condition)",
    "normalizers": ["whitespace", "semicolons"],
    "threshold": 3,
    "tags": ["javascript", "arrays"],
    "difficulty": 1
  },
  {
    "id": "drill-js-reduce-callback",
    "prompt": "Type the JavaScript Array.reduce callback signature.",
    "expected": "array.reduce((accumulator, value, index, array) => nextAccumulator, initialValue)",
    "normalizers": ["whitespace", "semicolons"],
    "threshold": 5,
    "tags": ["javascript", "arrays"],
    "difficulty": 2
  },
  {
    "id": "drill-js-promise-all",
    "prompt": "Type the Promise.all await pattern for an array named tasks.",
    "expected": "const results = await Promise.all(tasks)",
    "normalizers": ["whitespace", "semicolons"],
    "threshold": 2,
    "tags": ["javascript", "async"],
    "difficulty": 1
  },
  {
    "id": "drill-js-async-function",
    "prompt": "Type an async function declaration named loadData with no parameters.",
    "expected": "async function loadData() {}",
    "normalizers": ["whitespace", "semicolons"],
    "threshold": 2,
    "tags": ["javascript", "async"],
    "difficulty": 1
  },
  {
    "id": "drill-js-try-catch",
    "prompt": "Type a JavaScript try/catch block catching error.",
    "expected": "try {} catch (error) {}",
    "normalizers": ["whitespace", "semicolons"],
    "threshold": 2,
    "tags": ["javascript", "errors"],
    "difficulty": 1
  },
  {
    "id": "drill-js-event-listener",
    "prompt": "Type the addEventListener call for a click handler.",
    "expected": "element.addEventListener(\"click\", handleClick)",
    "normalizers": ["whitespace", "quotes", "semicolons"],
    "threshold": 2,
    "tags": ["javascript", "dom"],
    "difficulty": 1
  },
  {
    "id": "drill-js-query-selector",
    "prompt": "Type the DOM query for an element with id app.",
    "expected": "document.querySelector(\"#app\")",
    "normalizers": ["whitespace", "quotes", "semicolons"],
    "threshold": 1,
    "tags": ["javascript", "dom"],
    "difficulty": 1
  },
  {
    "id": "drill-js-destructure-object",
    "prompt": "Type object destructuring for name and age from user.",
    "expected": "const { name, age } = user",
    "normalizers": ["whitespace", "semicolons"],
    "threshold": 2,
    "tags": ["javascript", "syntax"],
    "difficulty": 1
  },
  {
    "id": "drill-js-destructure-array",
    "prompt": "Type array destructuring for first and second from items.",
    "expected": "const [first, second] = items",
    "normalizers": ["whitespace", "semicolons"],
    "threshold": 2,
    "tags": ["javascript", "syntax"],
    "difficulty": 1
  },
  {
    "id": "drill-js-class-constructor",
    "prompt": "Type a class constructor that stores name on this.",
    "expected": "constructor(name) { this.name = name }",
    "normalizers": ["whitespace", "semicolons"],
    "threshold": 3,
    "tags": ["javascript", "classes"],
    "difficulty": 2
  },
  {
    "id": "drill-js-module-import",
    "prompt": "Type a named import of readFile from node:fs/promises.",
    "expected": "import { readFile } from \"node:fs/promises\"",
    "normalizers": ["whitespace", "quotes", "semicolons"],
    "threshold": 2,
    "tags": ["javascript", "modules"],
    "difficulty": 1
  },
  {
    "id": "drill-js-module-export",
    "prompt": "Type a named export for function score.",
    "expected": "export function score() {}",
    "normalizers": ["whitespace", "semicolons"],
    "threshold": 2,
    "tags": ["javascript", "modules"],
    "difficulty": 1
  },
  {
    "id": "drill-js-nullish-coalescing",
    "prompt": "Type assignment of value to fallback only when value is nullish.",
    "expected": "const result = value ?? fallback",
    "normalizers": ["whitespace", "semicolons"],
    "threshold": 2,
    "tags": ["javascript", "syntax"],
    "difficulty": 1
  },
  {
    "id": "drill-js-optional-chaining",
    "prompt": "Type optional chaining to read user.profile.email.",
    "expected": "user?.profile?.email",
    "normalizers": ["whitespace", "semicolons"],
    "threshold": 1,
    "tags": ["javascript", "syntax"],
    "difficulty": 1
  },
  {
    "id": "drill-js-set-add",
    "prompt": "Type code to add value to a Set named seen.",
    "expected": "seen.add(value)",
    "normalizers": ["whitespace", "semicolons"],
    "threshold": 1,
    "tags": ["javascript", "data-structures"],
    "difficulty": 1
  },
  {
    "id": "drill-js-map-get",
    "prompt": "Type code to get key from a Map named counts.",
    "expected": "counts.get(key)",
    "normalizers": ["whitespace", "semicolons"],
    "threshold": 1,
    "tags": ["javascript", "data-structures"],
    "difficulty": 1
  },
  {
    "id": "drill-js-map-increment",
    "prompt": "Type code to increment counts map at key with default 0.",
    "expected": "counts.set(key, (counts.get(key) ?? 0) + 1)",
    "normalizers": ["whitespace", "semicolons"],
    "threshold": 4,
    "tags": ["javascript", "hash-map"],
    "difficulty": 2
  },
  {
    "id": "drill-js-json-parse",
    "prompt": "Type code to parse jsonText as JSON.",
    "expected": "const data = JSON.parse(jsonText)",
    "normalizers": ["whitespace", "semicolons"],
    "threshold": 2,
    "tags": ["javascript", "json"],
    "difficulty": 1
  },
  {
    "id": "drill-js-json-stringify",
    "prompt": "Type code to stringify data as JSON text.",
    "expected": "const jsonText = JSON.stringify(data)",
    "normalizers": ["whitespace", "semicolons"],
    "threshold": 2,
    "tags": ["javascript", "json"],
    "difficulty": 1
  },
  {
    "id": "drill-algo-binary-search-loop",
    "prompt": "Type the standard binary search loop condition with left and right inclusive.",
    "expected": "while (left <= right) {}",
    "normalizers": ["whitespace", "semicolons"],
    "threshold": 1,
    "tags": ["algorithms", "binary-search"],
    "difficulty": 2
  },
  {
    "id": "drill-algo-binary-search-mid",
    "prompt": "Type overflow-safe midpoint calculation for left and right.",
    "expected": "const mid = left + Math.floor((right - left) / 2)",
    "normalizers": ["whitespace", "semicolons"],
    "threshold": 3,
    "tags": ["algorithms", "binary-search"],
    "difficulty": 2
  },
  {
    "id": "drill-algo-two-pointer-loop",
    "prompt": "Type the two-pointer loop condition for left and right.",
    "expected": "while (left < right) {}",
    "normalizers": ["whitespace", "semicolons"],
    "threshold": 1,
    "tags": ["algorithms", "two-pointers"],
    "difficulty": 1
  },
  {
    "id": "drill-algo-sliding-window-grow",
    "prompt": "Type the line that adds nums[right] to windowSum.",
    "expected": "windowSum += nums[right]",
    "normalizers": ["whitespace", "semicolons"],
    "threshold": 1,
    "tags": ["algorithms", "sliding-window"],
    "difficulty": 1
  },
  {
    "id": "drill-algo-sliding-window-shrink",
    "prompt": "Type the line that removes nums[left] and advances left.",
    "expected": "windowSum -= nums[left++]",
    "normalizers": ["whitespace", "semicolons"],
    "threshold": 2,
    "tags": ["algorithms", "sliding-window"],
    "difficulty": 2
  },
  {
    "id": "drill-algo-bfs-queue-init",
    "prompt": "Type initialization for BFS queue with start.",
    "expected": "const queue = [start]",
    "normalizers": ["whitespace", "semicolons"],
    "threshold": 1,
    "tags": ["algorithms", "bfs"],
    "difficulty": 1
  },
  {
    "id": "drill-algo-bfs-pop-front",
    "prompt": "Type the simple JavaScript line to pop the front queue node.",
    "expected": "const node = queue.shift()",
    "normalizers": ["whitespace", "semicolons"],
    "threshold": 2,
    "tags": ["algorithms", "bfs"],
    "difficulty": 1
  },
  {
    "id": "drill-algo-bfs-visit-neighbor",
    "prompt": "Type BFS neighbor enqueue guarded by seen set.",
    "expected": "if (!seen.has(next)) { seen.add(next); queue.push(next) }",
    "normalizers": ["whitespace", "semicolons"],
    "threshold": 6,
    "tags": ["algorithms", "bfs"],
    "difficulty": 3
  },
  {
    "id": "drill-algo-dfs-base-case",
    "prompt": "Type a DFS visited guard using seen and node.",
    "expected": "if (seen.has(node)) return",
    "normalizers": ["whitespace", "semicolons"],
    "threshold": 2,
    "tags": ["algorithms", "dfs"],
    "difficulty": 2
  },
  {
    "id": "drill-algo-dfs-recursive-call",
    "prompt": "Type a recursive DFS call for each neighbor next.",
    "expected": "for (const next of graph[node]) dfs(next)",
    "normalizers": ["whitespace", "semicolons"],
    "threshold": 4,
    "tags": ["algorithms", "dfs"],
    "difficulty": 2
  },
  {
    "id": "drill-algo-quicksort-partition-swap",
    "prompt": "Type array destructuring swap for arr[i] and arr[j].",
    "expected": "[arr[i], arr[j]] = [arr[j], arr[i]]",
    "normalizers": ["whitespace", "semicolons"],
    "threshold": 3,
    "tags": ["algorithms", "sorting"],
    "difficulty": 2
  },
  {
    "id": "drill-algo-quicksort-pivot",
    "prompt": "Type a pivot selection from the right edge of arr.",
    "expected": "const pivot = arr[right]",
    "normalizers": ["whitespace", "semicolons"],
    "threshold": 1,
    "tags": ["algorithms", "sorting"],
    "difficulty": 1
  },
  {
    "id": "drill-algo-merge-loop",
    "prompt": "Type the merge loop condition while both arrays have remaining items.",
    "expected": "while (i < left.length && j < right.length) {}",
    "normalizers": ["whitespace", "semicolons"],
    "threshold": 3,
    "tags": ["algorithms", "sorting"],
    "difficulty": 2
  },
  {
    "id": "drill-algo-heap-parent",